{
  "id": "YYYY-MM-DDTHH-MM-SS-SEQ",
  "event_datetime": "2025-01-01T12:00:00+08:00",
  "recorded_at": "2025-01-01T12:00:00+08:00",
  "slug": "example-slug",

  "title": {
    "zh": "範例標題",
    "en": null
  },
  "short_sentence": {
    "zh": "一句話摘要（中文）",
    "en": null
  },
  "summary": {
    "zh": "一段較長的摘要（中文）",
    "en": null
  },
  "full_story": {
    "zh": "完整故事內容，分段可用換行符號。",
    "en": null
  },

  "tags": [
    "memory",
    "orientation"
  ],

  "clinical_links": {
    "mmse": [],
    "moca": [],
    "cdr_stage": null,
    "ad8_flags": []
  },

  "medical_interpretation": {
    "zh": null,
    "en": null
  },
  "care_advice": {
    "zh": null,
    "en": null
  },

  "related_cases": [],

  "created_at": "2025-01-01T12:00:00+08:00",
  "updated_at": "2025-01-01T12:00:00+08:00",
  "data_version": 1
}
